标题,中文标题,领域分类,研究机构,PDF链接,论文链接,简明摘要,Upvote数
"One-Step Residual Shifting Diffusion for Image Super-Resolution via
  Distillation",通过蒸馏实现的一步残差转移扩散图像超分辨率,Diffusion Model,Other,https://arxiv.org/pdf/2503.13358,https://huggingface.co/papers/2503.13358,本文提出了一种新的图像超分辨率（SR）方法RSD，旨在解决现有扩散模型在计算成本和视觉质量上的不足。RSD通过一种蒸馏方法训练学生网络，使其生成的图像与教师模型输出一致，从而实现单步恢复。实验表明，RSD在感知质量上超越了其他蒸馏方法（如SinSR），并与最先进的扩散模型相当。与基于预训练文本生成模型的SR方法相比，RSD在保持高质量图像的同时，减少了参数和GPU内存需求。研究在多个真实和合成数据集上进行了验证，结果显示出RSD的优越性。,75
"Stop Overthinking: A Survey on Efficient Reasoning for Large Language
  Models",停止过度思考：大型语言模型高效推理的调查,LLM,OpenAI,https://arxiv.org/pdf/2503.16419,https://huggingface.co/papers/2503.16419,本论文对大语言模型（LLMs）在高效推理方面的研究进行了系统性调查，重点探讨了应对“过度思考”现象的方法。尽管更长的推理链（CoT）可以提升性能，但也带来了显著的计算开销。作者将现有研究分为三大方向：模型优化、推理输出动态调整和输入提示优化，以实现高效推理。论文还探讨了使用高效数据训练推理模型的潜力，并评估小型语言模型的推理能力。通过建立公共资源库，作者旨在持续跟踪该领域的最新进展。,47
Survey on Evaluation of LLM-based Agents,基于LLM的智能体评估调查,Agent,Other,https://arxiv.org/pdf/2503.16416,https://huggingface.co/papers/2503.16416,本论文对基于大型语言模型（LLM）的智能体评估方法进行了首次全面调查，分析了评估基准和框架的四个关键维度：基本能力（如规划、工具使用、自我反思和记忆）、特定应用领域的基准（如网络、软件工程、科学和对话智能体）、通用智能体的基准，以及评估框架。研究揭示了向更现实和具有挑战性的评估转变的趋势，并指出了在成本效益、安全性和鲁棒性评估等方面的研究空白。该调查为快速发展的智能体评估领域提供了清晰的地图，识别了当前的限制，并提出了未来研究的方向。,43
Unleashing Vecset Diffusion Model for Fast Shape Generation,释放Vecset扩散模型以实现快速形状生成,Diffusion Model,Tencent,https://arxiv.org/pdf/2503.16302,https://huggingface.co/papers/2503.16302,本论文提出了FlashVDM，一个系统框架，用于加速Vecset扩散模型（VDM）在3D形状生成中的应用。尽管VDM在生成高分辨率3D形状方面表现出色，但其生成速度仍显不足。FlashVDM通过引入渐进流蒸馏和高效的解码器设计，显著提高了模型的推理速度，减少了重建和生成的推理时间，分别提升了超过45倍和32倍。通过对Hunyuan3D-2的应用，FlashVDM在保持与现有最先进技术相当的性能的同时，展示了其在快速3D生成领域的显著优势。,32
Cosmos-Reason1: From Physical Common Sense To Embodied Reasoning,Cosmos-Reason1：从物理常识到具身推理,Multimodal LLM,Other,https://arxiv.org/pdf/2503.15558,https://huggingface.co/papers/2503.15558,本文介绍了Cosmos-Reason1模型，旨在提升物理人工智能系统的理解与决策能力，使其能够在物理世界中进行复杂操作。研究重点在于物理常识和具身推理，提出了两个层次的本体结构来表示这些知识。开发了两种多模态大型语言模型（Cosmos-Reason1-8B和Cosmos-Reason1-56B），通过视觉预训练、监督微调和强化学习等四个阶段进行训练。评估结果表明，采用物理AI微调与强化学习显著提升了模型性能。研究成果将为物理AI的发展提供基础，并将代码和预训练模型开放共享。,27
Scale-wise Distillation of Diffusion Models,扩散模型的尺度级蒸馏,Diffusion Model,Other,https://arxiv.org/pdf/2503.16397,https://huggingface.co/papers/2503.16397,本论文提出了一种名为SWD的规模化蒸馏框架，用于扩散模型（DMs），旨在通过逐步生成和上采样降低计算成本。SWD借鉴了扩散过程与隐式谱自回归的关系，允许模型在较低的数据分辨率下启动生成，并在每个去噪步骤中逐渐提升样本质量。该方法自然融入现有的基于分布匹配的蒸馏技术，并引入了一种新颖的补丁损失函数，以增强目标分布的细粒度相似性。应用于文本到图像的扩散模型时，SWD显著提高了推理速度，并在相同计算预算下超越了其他方法，展示了其在图像生成领域的潜力。,26
"JARVIS-VLA: Post-Training Large-Scale Vision Language Models to Play
  Visual Games with Keyboards and Mouse",JARVIS-VLA：后训练的大规模视觉语言模型用于通过键盘和鼠标玩视觉游戏,Embodied AI,PKU,https://arxiv.org/pdf/2503.16365,https://huggingface.co/papers/2503.16365,本文提出了一种新的后训练方法——视觉语言行动（VLA）模型，通过自监督的视觉和语言指导，提升了视觉语言模型（VLMs）在开放世界环境中的决策能力。该方法显著增强了模型的世界知识、视觉识别和空间定位能力，使其能够在Minecraft中执行超过1000种人类指令的任务，如制作、冶炼和采矿。实验结果表明，该模型在多样化的原子任务上较最佳基线提高了40%的性能，并超越了传统的模仿学习策略，达到了最先进的表现。研究成果及相关代码和数据集已开源，以促进进一步研究。,25
DiffMoE: Dynamic Token Selection for Scalable Diffusion Transformers,DiffMoE：可扩展扩散变换器的动态令牌选择,Diffusion Model,Other,https://arxiv.org/pdf/2503.14487,https://huggingface.co/papers/2503.14487,本文提出了一种新颖的动态令牌选择架构DiffMoE，旨在提升扩散变换器在图像生成任务中的表现。DiffMoE通过引入批量级的全局令牌池，使专家能够在训练过程中访问全局令牌分布，从而促进专业化的专家行为。该方法还结合了动态容量预测器，根据噪声水平和样本复杂性动态分配计算资源。经过全面评估，DiffMoE在ImageNet基准测试中表现优异，显著超越了传统密集架构和现有的专家模型，且在维持相同计算参数的情况下，展现出在更具挑战性的任务（如文本到图像生成）中的广泛适用性。,23
Why Do Multi-Agent LLM Systems Fail?,为什么多智能体大语言模型系统会失败？,Agent,Other,https://arxiv.org/pdf/2503.13657,https://huggingface.co/papers/2503.13657,本文对多智能体系统（MAS）中的挑战进行了首次全面研究，尽管这些系统在多个任务中表现出色，但与单智能体框架相比，性能提升仍然有限。研究分析了五个流行的MAS框架，识别出14种独特的失败模式，并提出了一种适用于不同MAS框架的分类法。这些失败模式被归纳为三个主要类别：系统设计失败、智能体间的不一致以及任务验证与终止问题。此外，论文提出了改善智能体角色规范和增强协调策略的干预措施，以减少这些失败。研究结果为未来的研究提供了明确的方向，并开源了相关数据集和LLM注释工具。,21
InfiniteYou: Flexible Photo Recrafting While Preserving Your Identity,InfiniteYou：灵活的照片重塑与身份保留,Diffusion Model,ByteDance,https://arxiv.org/pdf/2503.16418,https://huggingface.co/papers/2503.16418,论文《InfiniteYou: Flexible Photo Recrafting While Preserving Your Identity》提出了一种新框架InfiniteYou（InfU），旨在实现高保真度的身份保留图像生成。InfU利用先进的扩散变换器（DiTs），通过引入InfuseNet模块增强身份相似性，同时保持生成能力。该框架采用多阶段训练策略，结合合成的单人多样本数据，改善文本与图像的对齐，提高图像质量，并减少面部复制问题。实验结果表明，InfU在性能上超越了现有基准，并且其即插即用的设计确保了与多种现有方法的兼容性，为相关领域提供了重要贡献。,20
"Plug-and-Play 1.x-Bit KV Cache Quantization for Video Large Language
  Models",即插即用的1.x位KV缓存量化方法用于视频大语言模型,Multimodal LLM,Other,https://arxiv.org/pdf/2503.16257,https://huggingface.co/papers/2503.16257,本论文提出了一种名为VidKV的插件式KV缓存量化方法，旨在降低视频大型语言模型（VideoLLMs）中的KV缓存内存需求。研究发现，2位KV量化对模型性能影响甚微，但更低位数的量化尚未得到充分探索。VidKV通过混合精度量化策略对键进行处理，并对值实施1.58位量化，同时选择性过滤重要的视觉标记，以实现精度与性能之间的良好平衡。实验结果表明，VidKV能够将KV缓存压缩至1.5位和1.58位，而几乎不影响模型性能，显著提高了推理速度和内存效率。,17
"MathFusion: Enhancing Mathematic Problem-solving of LLM through
  Instruction Fusion",MathFusion：通过指令融合增强大语言模型的数学问题解决能力,LLM,"Shanghai AI Lab, THU, PKU",https://arxiv.org/pdf/2503.16212,https://huggingface.co/papers/2503.16212,论文介绍了MathFusion，一个新框架，通过跨问题指令融合来提升大型语言模型（LLMs）的数学推理能力。MathFusion采用三种融合策略：顺序融合、并行融合和条件融合，以更好地捕捉数学知识中的内在关系。通过这些策略，研究团队生成了新的数据集MathFusionQA，并对多个模型进行了微调。实验结果表明，MathFusion在保持高数据效率的同时，显著提高了数学推理的准确性，平均提升18.0个百分点，且只需额外45K的合成指令。该研究为数学问题解决提供了新的思路和方法。,17
SynCity: Training-Free Generation of 3D Worlds,SynCity：无训练生成3D世界,Other,Other,https://arxiv.org/pdf/2503.16420,https://huggingface.co/papers/2503.16420,本文提出了一种名为SynCity的方法，旨在从文本描述生成复杂的3D世界。该方法无需训练或优化，结合了预训练的3D生成模型的几何精度与2D图像生成器的艺术灵活性。与传统的以对象为中心的3D生成模型不同，SynCity采用基于瓦片的生成策略，逐块构建场景，允许对布局和外观进行细致控制。通过这种方法，SynCity能够生成丰富多样且引人入胜的3D场景，显著简化了3D内容的创建过程，具有广泛的应用潜力。,15
Inside-Out: Hidden Factual Knowledge in LLMs,从内到外：大语言模型中的隐性事实知识,LLM,Google,https://arxiv.org/pdf/2503.15299,https://huggingface.co/papers/2503.15299,本文提出了一种框架，用于评估大型语言模型（LLMs）是否在其参数中编码了比其输出中表达的更多事实知识。研究定义了知识的量化方法，并区分了外部知识和内部知识，发现隐藏知识存在于内部知识超过外部知识的情况下。通过对三种流行的开放权重LLM进行案例研究，结果表明LLMs内部编码的事实知识平均比外部表达多40%。值得注意的是，有些知识如此隐蔽，以至于模型可以完美地内部知道答案，却从未生成过。这一发现揭示了LLMs生成能力的根本限制，并对闭卷问答中的计算效率提出了挑战。,14
"Fin-R1: A Large Language Model for Financial Reasoning through
  Reinforcement Learning",Fin-R1：通过强化学习进行金融推理的大型语言模型,LLM,Other,https://arxiv.org/pdf/2503.16252,https://huggingface.co/papers/2503.16252,本文介绍了Fin-R1，一种专为金融推理设计的大型语言模型。Fin-R1采用七亿参数的轻量级架构，旨在解决金融领域中的数据碎片化、推理逻辑不稳定和商业泛化能力弱等问题。通过构建高质量的金融推理数据集，并采用监督微调和强化学习的两阶段训练方法，Fin-R1在多个金融推理任务中表现出色，特别是在ConvFinQA和FinQA任务中达到了最先进的水平。尽管模型参数较少，Fin-R1在实际应用中展现了强大的自动推理和决策能力，为金融行业提供了高效的解决方案。代码可在GitHub上获取。,14
M3: 3D-Spatial MultiModal Memory,M3：3D空间多模态记忆,Multimodal LLM,Other,https://arxiv.org/pdf/2503.16413,https://huggingface.co/papers/2503.16413,本文提出了3D空间多模态记忆系统（M3），旨在通过视频源保留中等规模静态场景的信息，以增强视觉感知。M3结合了3D高斯散射技术与基础模型，构建了一种高效的多模态记忆，能够在不同粒度上渲染特征表示。针对先前研究中存储高维特征的计算限制和特征对齐问题，M3引入了主要场景组件和高斯记忆注意力机制，从而提升了训练和推理效率。通过定量评估和定性可视化，验证了M3在多种基础模型中的有效性，并展示了其在室内场景下的实际应用，标志着在3D特征蒸馏中的重要进展。,13
"Reinforcement Learning for Reasoning in Small LLMs: What Works and What
  Doesn't",强化学习在小型大语言模型中的推理：有效与无效的探索,LLM,Other,https://arxiv.org/pdf/2503.16219,https://huggingface.co/papers/2503.16219,本研究探讨了使用强化学习（RL）提升小型语言模型（LLMs）推理能力的潜力，重点关注一个15亿参数的模型DeepSeek-R1-Distill-Qwen-1.5B。我们在严格的资源限制下进行训练，采用了Group Relative Policy Optimization（GRPO）算法，并构建了高质量的数学推理数据集。实验结果显示，模型的推理精度显著提升，例如AMC23准确率从63%提高到80%，且训练成本仅为42美元，远低于基线模型的数千美元。然而，研究中也发现了优化不稳定性和长度限制等挑战。这些发现为资源有限环境中的推理能力提升提供了经济有效的方案，并将相关代码和数据集开源，助力后续研究。,13
"LHM: Large Animatable Human Reconstruction Model from a Single Image in
  Seconds",LHM：从单张图像快速重建可动画的大型人类模型,Other,Alibaba,https://arxiv.org/pdf/2503.10625,https://huggingface.co/papers/2503.10625,本文提出了LHM（Large Animatable Human Reconstruction Model），一种能够在几秒钟内从单张图像重建可动画3D人类头像的模型。LHM利用多模态变换器架构，有效编码人体位置和图像特征，确保细致的服装几何和纹理保留。为增强面部身份和细节恢复，模型采用了头部特征金字塔编码方案。实验表明，LHM在重建准确性和泛化能力上超越了现有方法，且无需后处理即可生成逼真的可动画人类头像，适用于增强现实和虚拟现实应用。,12
1000+ FPS 4D Gaussian Splatting for Dynamic Scene Rendering,1000+ FPS 4D高斯点云渲染动态场景,Other,Other,https://arxiv.org/pdf/2503.16422,https://huggingface.co/papers/2503.16422,本论文提出了一种新方法4DGS-1K，用于动态场景渲染，能在现代GPU上实现超过1000帧每秒的渲染速度，同时保持相似的视觉质量。研究识别了4D高斯点云（4DGS）中存在的两个主要冗余源：短生命周期高斯和非活跃高斯。通过引入空间-时间变化评分来有效去除短生命周期高斯，并存储连续帧的活跃高斯掩码，显著降低了存储需求（减少41倍）和计算开销（加速9倍）。该方法在复杂动态场景中表现出色，为实时应用提供了更高效的解决方案。,11
CaKE: Circuit-aware Editing Enables Generalizable Knowledge Learners,CaKE：电路感知编辑使知识学习者具备泛化能力,LLM,Other,https://arxiv.org/pdf/2503.16356,https://huggingface.co/papers/2503.16356,本论文提出了一种新的知识编辑方法CaKE（Circuit-aware Knowledge Editing），旨在提高大型语言模型（LLMs）在多跳推理任务中的知识更新能力。现有的知识编辑方法往往只能更新孤立的事实，难以将这些更新有效地整合到推理过程中。CaKE通过分析推理电路，利用精心策划的数据来促进模型使用修改后的知识，从而激励模型发展适应新知识的推理电路。实验结果表明，CaKE在MQuAKE数据集上的多跳推理准确率平均提高了20%，显著提升了知识更新的准确性和一致性。,11
Ultra-Resolution Adaptation with Ease,轻松实现超分辨率适应,Diffusion Model,Other,https://arxiv.org/pdf/2503.16322,https://huggingface.co/papers/2503.16322,本论文提出了一种名为URAE的超分辨率适应方法，旨在解决高分辨率图像生成中的数据和参数效率问题。研究表明，利用教师模型生成的合成数据可以显著提升训练收敛速度；同时，在缺乏合成数据的情况下，调整权重矩阵的次要组件比常用的低秩适配器效果更佳。此外，对于使用引导蒸馏的模型，适应过程中禁用无分类器引导是获得良好性能的关键。实验结果表明，URAE在仅使用3000个样本和2000次迭代的情况下，能达到与现有顶尖闭源模型相媲美的2K生成性能，并为4K分辨率生成设定了新基准。,11
"Expert Race: A Flexible Routing Strategy for Scaling Diffusion
  Transformer with Mixture of Experts",专家竞赛：一种灵活的路由策略用于扩展混合专家的扩散变换器,Diffusion Model,ByteDance,https://arxiv.org/pdf/2503.16057,https://huggingface.co/papers/2503.16057,本论文提出了一种新型的混合专家模型Race-DiT，旨在提升扩散变换器的可扩展性和性能。通过灵活的路由策略“专家竞赛”，模型能够动态选择关键令牌的专家，从而优化专家的利用率。为了解决浅层学习中的挑战，研究还引入了逐层正则化和路由相似性损失，以防止模式崩溃。通过在ImageNet上的广泛实验，结果显示该方法显著提升了模型性能，展现了良好的扩展性。,11
Tokenize Image as a Set,将图像标记为集合,Diffusion Model,Tencent,https://arxiv.org/pdf/2503.16425,https://huggingface.co/papers/2503.16425,本论文提出了一种全新的图像生成范式，通过基于集合的标记化和分布建模，取代传统的固定位置潜在编码方法。我们引入无序的标记集合表示，动态分配编码容量以适应区域语义复杂性，从而增强全局上下文聚合能力并提高对局部干扰的鲁棒性。为了解决离散集合建模的挑战，我们设计了一种双重转换机制，将集合双射转换为具有和约束的固定长度整数序列。此外，我们提出了固定和离散扩散框架，首次同时处理离散值、固定序列长度和和不变性。实验结果表明，我们的方法在语义感知表示和生成质量上优于传统方法，推动了视觉生成技术的发展。,10
XAttention: Block Sparse Attention with Antidiagonal Scoring,XAttention：具有反对角评分的块稀疏注意力,LLM,Other,https://arxiv.org/pdf/2503.16428,https://huggingface.co/papers/2503.16428,本文提出了XAttention，一种用于长上下文Transformer模型的块稀疏注意力框架，旨在降低计算成本。XAttention的创新在于利用注意力矩阵的反对角线值之和作为块重要性的有效代理，从而精确识别和修剪不必要的块，实现高稀疏性和显著加速推理。通过在多个长上下文基准（如RULER、LongBench、VideoMME和VBench）上的评估，XAttention在保持与全注意力相当的准确性的同时，展示了最高可达13.5倍的计算加速。这一成果为长上下文Transformer模型的实际应用提供了可扩展、高效的解决方案。,9
"MagicMotion: Controllable Video Generation with Dense-to-Sparse
  Trajectory Guidance",MagicMotion：基于稠密到稀疏轨迹指导的可控视频生成,Other,Microsoft,https://arxiv.org/pdf/2503.16421,https://huggingface.co/papers/2503.16421,本文介绍了MagicMotion，一个新颖的图像到视频生成框架，旨在解决现有轨迹可控视频生成方法在复杂物体运动和多物体控制方面的不足。MagicMotion通过三种不同的控制级别（掩码、边界框和稀疏框）实现精确的物体运动控制，能够在保持物体一致性和视觉质量的同时，沿用户指定的轨迹生成高质量视频。此外，论文还推出了MagicData，一个大规模的轨迹控制视频数据集，以及MagicBench，一个评估视频质量和轨迹控制准确性的基准。实验结果表明，MagicMotion在多个指标上优于现有方法。,8
NuiScene: Exploring Efficient Generation of Unbounded Outdoor Scenes,NuiScene：探索无界户外场景的高效生成,Diffusion Model,Other,https://arxiv.org/pdf/2503.16375,https://huggingface.co/papers/2503.16375,本论文提出了一种高效的户外场景生成方法，旨在克服传统室内场景生成的局限，解决户外场景中高度变化大和快速生成大规模景观的挑战。研究者们通过将场景块编码为统一的向量集，显著提升了压缩性能和生成效率。此外，论文中训练的显式外扩模型相较于以往的重采样方法，提供了更好的连贯性并加快了生成速度。为支持这一研究，作者们整理了高质量的数据集NuiScene43，展示了模型在不同风格环境中融合的潜力，从而推动了异质场景的联合训练。,8
SALT: Singular Value Adaptation with Low-Rank Transformation,SALT：具有低秩变换的奇异值适应,Other,Other,https://arxiv.org/pdf/2503.16055,https://huggingface.co/papers/2503.16055,本文提出了一种新方法SALT（基于低秩变换的奇异值适应），旨在提高医学图像分割中的模型适应性。SALT结合了低秩适应（LoRA）和奇异值分解（SVD）的优点，通过可训练的缩放和偏移参数选择性调整重要的奇异值，同时对其余子空间进行低秩更新。该方法在五个具有挑战性的医学数据集上进行评估，结果显示SALT在Dice系数上比现有的PEFT方法（如LoRA和SVD）提高了2%至5%，并且仅需3.9%的可训练参数，展现了在低资源环境中的强大适应能力。,8
"BigO(Bench) -- Can LLMs Generate Code with Controlled Time and Space
  Complexity?",BigO(Bench) -- 大语言模型能否生成具有可控时间和空间复杂度的代码？,LLM,Meta,https://arxiv.org/pdf/2503.15242,https://huggingface.co/papers/2503.15242,"本文介绍了BigO(Bench)，一个新颖的编码基准，旨在评估生成语言模型在理解和生成具有特定时间和空间复杂度的代码方面的能力。该基准填补了现有评估中对模型在计算复杂度约束下的表现关注不足的空白。BigO(Bench)包含3,105个编码问题和1,190,250个标注了解析复杂度的解决方案，并提供了相应的运行时和内存占用数据。通过对多个先进语言模型的评估，结果显示尽管这些模型在代码生成上表现优异，但在复杂度理解方面存在明显不足，提示其在未训练任务上的泛化能力有限。",7
Agents Play Thousands of 3D Video Games,智能体玩数千款3D视频游戏,Agent,Tencent,https://arxiv.org/pdf/2503.13356,https://huggingface.co/papers/2503.13356,本文提出了PORTAL框架，旨在开发能够通过语言引导生成策略的人工智能代理，以便在数千款3D视频游戏中进行游戏。该方法将决策问题转化为语言建模任务，利用大型语言模型生成特定领域的行为树，从而减少传统强化学习方法的计算负担，同时保持战略深度和适应性。PORTAL结合了基于规则的节点和神经网络组件，支持高层次战略推理和精确的低层次控制。实验结果显示，PORTAL在第一人称射击游戏中的表现显著提升了开发效率、策略泛化能力和行为多样性，标志着游戏AI开发的重要进展。,7
CLS-RL: Image Classification with Rule-Based Reinforcement Learning,CLS-RL：基于规则的强化学习图像分类,Multimodal LLM,Shanghai AI Lab,https://arxiv.org/pdf/2503.16188,https://huggingface.co/papers/2503.16188,本论文提出了一种名为CLS-RL的基于规则的强化学习方法，以改进多模态大语言模型（MLLMs）在图像分类任务中的表现。研究发现，传统的监督微调（SFT）在少量样本的情况下可能导致严重的过拟合，而CLS-RL通过使用可验证信号作为奖励，显著提升了模型在多个数据集上的分类准确性。此外，论文还引入了No-Thinking-CLS-RL方法，减少了微调过程中的思考时间，从而在保持高性能的同时缩短了训练时间。研究结果表明，RL方法有效地帮助模型掌握分类基础，具有较强的泛化能力。,6
