标题,中文标题,领域分类,研究机构,PDF链接,论文链接,简明摘要,Upvote数
"VideoRFSplat: Direct Scene-Level Text-to-3D Gaussian Splatting
  Generation with Flexible Pose and Multi-View Joint Modeling",VideoRFSplat：直接场景级文本到3D高斯点云生成与灵活姿态和多视角联合建模,Other,Other,https://arxiv.org/pdf/2503.15855,https://huggingface.co/papers/2503.15855,本文提出了VideoRFSplat，一种直接将文本生成3D场景的模型，利用视频生成技术生成逼真的3D高斯点云。与以往依赖后处理精炼的方法不同，VideoRFSplat通过双流架构同时建模多视角图像和相机姿态，减少了不同模态间的干扰。此外，采用异步采样策略加速了相机姿态的去噪过程，从而提高了多视角生成的准确性和一致性。经过在多个大规模真实数据集上的训练，VideoRFSplat在生成质量上超越了现有方法，展示了其在增强现实、游戏和机器人等领域的潜在应用价值。,2
"MotionStreamer: Streaming Motion Generation via Diffusion-based
  Autoregressive Model in Causal Latent Space",MotionStreamer：基于扩散的自回归模型在因果潜在空间中的流式运动生成,Diffusion Model,Other,https://arxiv.org/pdf/2503.15451,https://huggingface.co/papers/2503.15451,本论文提出了MotionStreamer，一个创新的框架，用于文本条件下的流式动作生成。该方法通过引入连续因果潜在空间，克服了现有扩散模型在预定义动作长度上的限制和GPT模型在离散化过程中的延迟响应及误差累积问题。MotionStreamer能够实时预测人类姿态，充分利用历史动作信息，实现准确的在线动作解码。实验结果表明，该方法在多轮生成、长时间生成和动态动作组合等多种应用中表现优于现有技术，展现了其在实时应用中的潜力。,2
Make Your Training Flexible: Towards Deployment-Efficient Video Models,让你的训练更灵活：朝着高效部署的视频模型,Other,Shanghai AI Lab,https://arxiv.org/pdf/2503.14237,https://huggingface.co/papers/2503.14237,本论文提出了一种新的视频训练方法，旨在提高模型在不同计算预算下的适应性与效率。传统方法依赖固定数量的采样标记，导致计算和准确性之间的权衡不理想。为此，作者引入了“Token Optimization”测试设置，通过灵活的采样和标记选择来优化输入信息。核心工具“Flux”可轻松集成到现有视频训练框架中，显著提升模型的鲁棒性。实验结果表明，使用仅1/4的标记，FluxViT模型在多个任务上实现了新的最优性能，并节省了近90%的计算资源。所有模型和数据已公开。,2
"Reinforcement Learning for Reasoning in Small LLMs: What Works and What
  Doesn't",小型大语言模型中的推理强化学习：有效与无效的探索,LLM,Other,https://arxiv.org/pdf/2503.16219,https://huggingface.co/papers/2503.16219,本研究探讨了如何通过强化学习（RL）提升小型语言模型（LLMs）的推理能力，特别是针对一款1.5亿参数的模型DeepSeek-R1-Distill-Qwen-1.5B。在仅使用4个NVIDIA A40 GPU和24小时的训练时间内，我们应用了改进的群体相对策略优化算法，并构建了高质量的数学推理数据集。实验结果显示，模型的推理准确率显著提升，AMC23的准确率从63%提高到80%。尽管在长时间训练中出现了优化不稳定和长度限制等挑战，我们的研究表明，RL微调为资源有限的环境提供了一种有效且经济的替代方案。相关代码和数据集已开放共享。,1
"See-Saw Modality Balance: See Gradient, and Sew Impaired Vision-Language
  Balance to Mitigate Dominant Modality Bias",跷跷板模态平衡：观察梯度，缝合受损的视觉-语言平衡以减轻主导模态偏见,Multimodal LLM,Other,https://arxiv.org/pdf/2503.13834,https://huggingface.co/papers/2503.13834,本论文探讨了视觉-语言（VL）模型中的“主导模态偏见”，即模型在预测时过度依赖特定模态，导致性能下降。研究分析了这一偏见的成因，并提出了一种新框架BalGrad，通过对梯度进行重新加权和任务方向对齐，来缓解这一问题。实验结果表明，BalGrad在UPMC Food-101、Hateful Memes和MM-IMDb等数据集上有效降低了模型对单一模态的依赖，从而提升了整体预测性能。这一研究为改进多模态模型的平衡性提供了新的方法论。,1
