标题,中文标题,领域分类,研究机构,PDF链接,论文链接,简明摘要,Upvote数
"Zero-1-to-A: Zero-Shot One Image to Animatable Head Avatars Using Video
  Diffusion",Zero-1-to-A：使用视频扩散生成零样本单图像可动画头部头像,Diffusion Model,Other,https://arxiv.org/pdf/2503.15851,https://huggingface.co/papers/2503.15851,论文《Zero-1-to-A: Zero-Shot One Image to Animatable Head Avatars Using Video Diffusion》提出了一种新方法，旨在通过视频扩散模型生成可动画的4D头像，减少训练所需的数据量。该方法名为Zero-1-to-A，采用渐进式学习策略，分为空间一致性学习和时间一致性学习两个阶段，从而确保生成的头像在质量上平滑提升。实验结果表明，Zero-1-to-A在头像的真实感、动画质量和渲染速度方面优于现有方法，提供了一种高效的解决方案用于生动的头像创建。代码已公开发布。,6
Towards Unified Latent Space for 3D Molecular Latent Diffusion Modeling,朝向统一潜在空间的3D分子潜在扩散建模,Diffusion Model,Other,https://arxiv.org/pdf/2503.15567,https://huggingface.co/papers/2503.15567,本论文提出了一种新的统一潜在空间模型，名为统一变分自编码器（UAE-3D），旨在提高3D分子生成的效率和质量。传统方法通常为不同的模态（如原子类型、化学键和3D坐标）维护独立的潜在空间，这降低了训练和采样的效率。UAE-3D通过将3D分子压缩为来自统一潜在空间的序列，克服了多模态和等变性处理的复杂性，同时保持近乎零的重构误差。研究表明，该模型在GEOM-Drugs和QM9数据集上的实验结果显著提升了新分子生成的基准，展示了其在药物发现和材料科学中的潜在应用价值。,6
"Uni-3DAR: Unified 3D Generation and Understanding via Autoregression on
  Compressed Spatial Tokens",Uni-3DAR：通过对压缩空间标记的自回归实现统一的3D生成与理解,Other,PKU,https://arxiv.org/pdf/2503.16278,https://huggingface.co/papers/2503.16278,本论文提出了Uni-3DAR，一个统一的框架，通过自回归预测整合3D生成与理解（3D GU）任务。Uni-3DAR采用新颖的分层标记方法，利用八叉树压缩3D空间，并通过细粒度标记捕捉微观结构的关键信息。为提升效率，论文引入了两项优化策略：一种两级子树压缩方法可将八叉树标记序列减少至8倍，另一种动态掩蔽下一个标记预测机制显著提升模型性能。实验结果显示，Uni-3DAR在多种微观3D GU任务中表现优异，超越了现有的扩散模型，取得高达256%的相对提升，并实现了21.8倍的推理速度加快。,5
Make Your Training Flexible: Towards Deployment-Efficient Video Models,让你的训练更加灵活：朝着高效部署的视频模型,Other,Shanghai AI Lab,https://arxiv.org/pdf/2503.14237,https://huggingface.co/papers/2503.14237,该论文提出了一种新的视频模型训练方法，旨在提高模型在实际部署中的效率。现有方法通常依赖固定数量的采样令牌，导致计算和准确性之间的权衡不理想。为了解决这个问题，作者引入了“令牌优化”的新测试设置，并开发了一种名为Flux的增强工具，使采样网格灵活化，从而优化输入令牌的选择。通过在大规模视频预训练中应用Flux，所提出的FluxViT模型在多个任务上实现了新的最优性能，且仅使用四分之一的令牌即可匹配之前的最佳模型，节省了近90%的计算资源。这一方法的灵活性和高效性使其易于在现有视频训练框架中应用。,5
Sonata: Self-Supervised Learning of Reliable Point Representations,Sonata：自监督学习可靠点表示,Other,Meta,https://arxiv.org/pdf/2503.16429,https://huggingface.co/papers/2503.16429,本文提出了Sonata，一种自监督学习方法，旨在提高点云数据的表示质量，以便在多种3D任务中实现高效的线性探测。研究发现，现有的3D自监督学习模型在表示质量上存在不足，主要源于“几何捷径”现象，导致模型仅关注低级空间特征。Sonata通过遮蔽空间信息和增强输入特征的依赖性，利用自蒸馏技术构建了一个包含14万点云的数据集。结果表明，Sonata在ScanNet数据集上线性探测准确率提高了3.3倍，且在参数和数据效率上表现优异，推动了3D室内外感知任务的最新进展。,4
UVE: Are MLLMs Unified Evaluators for AI-Generated Videos?,UVE：多模态大语言模型是否是AI生成视频的统一评估者？,Multimodal LLM,ByteDance,https://arxiv.org/pdf/2503.09949,https://huggingface.co/papers/2503.09949,本论文探讨了使用多模态大语言模型（MLLMs）作为统一评估器来评估AI生成视频（AIGVs）的可行性。随着视频生成模型（VGMs）的快速发展，现有的评估方法存在局限，难以满足对更细致和全面评估的需求。为此，研究者们引入了UVE-Bench基准，收集了由先进VGM生成的视频，并提供了15个评估方面的人工偏好注释。通过对16个MLLM的评估，结果显示尽管这些模型仍不及人类评估者，但在统一AIGV评估中表现优于现有专门评估方法。论文还深入分析了影响MLLM评估性能的关键设计选择，为未来研究提供了有价值的见解。,4
"See-Saw Modality Balance: See Gradient, and Sew Impaired Vision-Language
  Balance to Mitigate Dominant Modality Bias",跷跷板模态平衡：观察梯度，缝合受损的视觉-语言平衡以减轻主导模态偏差,Multimodal LLM,Other,https://arxiv.org/pdf/2503.13834,https://huggingface.co/papers/2503.13834,本文探讨了视觉-语言（VL）模型中的“主导模态偏差”问题，该偏差导致模型在预测时过于依赖特定模态，尤其在某一模态受损时表现不佳。研究分析了这一现象的原因，发现不对齐的梯度和梯度幅度差异妨碍了损失的平衡收敛。为此，提出了新框架BalGrad，通过模态间梯度重加权和任务间梯度投影等方法来缓解主导模态偏差。实验结果表明，BalGrad在多个数据集上有效提高了模型的预测性能，减少了对特定模态的过度依赖。,4
"MagicID: Hybrid Preference Optimization for ID-Consistent and
  Dynamic-Preserved Video Customization",MagicID：用于保持身份一致性和动态保留的视频定制的混合偏好优化,Other,Other,https://arxiv.org/pdf/2503.12689,https://huggingface.co/papers/2503.12689,论文《MagicID: Hybrid Preference Optimization for ID-Consistent and Dynamic-Preserved Video Customization》提出了一种新框架MagicID，旨在解决视频身份定制中的两个主要问题：视频长度导致的身份降解和训练过程中动态性降低。通过构建具有明确身份和动态奖励的成对偏好视频数据，MagicID优化了视频生成过程，确保生成的视频既保持一致的身份特征，又展现自然的动态效果。此外，论文引入了一种混合采样策略，优先考虑身份保留，并通过前沿采样方法提升动态质量。实验结果表明，MagicID在多个指标上超越了现有方法，具有显著的实用价值。,4
"Improving Autoregressive Image Generation through Coarse-to-Fine Token
  Prediction",通过粗到细的标记预测改善自回归图像生成,Other,Shanghai AI Lab,https://arxiv.org/pdf/2503.16194,https://huggingface.co/papers/2503.16194,本论文提出了一种改进的自回归图像生成方法，通过粗到细的标记预测（CTF）来优化大词汇表的使用。研究发现，相似的代码词表示会对生成图像产生相似效果，表明大词汇表中存在显著冗余。为此，作者设计了一个两阶段框架：首先，利用自回归模型顺序预测每个标记的粗标签；其次，辅助模型在条件粗标签下同时预测所有标记的细标签。实验结果表明，该方法在ImageNet上显著提升了生成效果，Inception Score平均提高了59分，同时实现了更快的采样速度。,3
"Deceptive Humor: A Synthetic Multilingual Benchmark Dataset for Bridging
  Fabricated Claims with Humorous Content",欺骗幽默：一个合成的多语言基准数据集，用于连接虚假声明与幽默内容,LLM,Other,https://arxiv.org/pdf/2503.16031,https://huggingface.co/papers/2503.16031,本文介绍了“欺骗性幽默数据集”（DHD），这是一个用于研究源自虚假信息的幽默的新资源。DHD包含从虚假叙述中生成的幽默评论，使用ChatGPT-4o模型创建，并根据讽刺程度和五种幽默类别（黑色幽默、讽刺、社会评论、文字游戏和荒诞性）进行标注。该数据集支持多种语言，包括英语和印度地方语言，提供了分析幽默与虚假信息交织的新基础。通过建立强基线，DHD为未来的欺骗性幽默检测模型研究奠定了基础，推动了这一新兴研究方向的发展。,3
"VideoRFSplat: Direct Scene-Level Text-to-3D Gaussian Splatting
  Generation with Flexible Pose and Multi-View Joint Modeling",VideoRFSplat：直接场景级文本到3D高斯喷溅生成与灵活姿态和多视图联合建模,Other,Other,https://arxiv.org/pdf/2503.15855,https://huggingface.co/papers/2503.15855,本文提出了VideoRFSplat，一个直接文本到3D模型，利用视频生成模型生成逼真的3D高斯点云（3DGS）场景。与传统方法不同，VideoRFSplat采用双流架构同时建模多视图图像和摄像机姿态，减少了这两种模态之间的干扰。此外，文章还引入了一种异步采样策略，使得摄像机姿态的去噪速度快于多视图图像，从而提高了跨模态一致性。经过在多个大规模真实数据集上的训练，VideoRFSplat在无需后期精炼的情况下，超越了现有的文本到3D生成方法，展示了其在生成真实世界场景方面的优越性。,3
"MotionStreamer: Streaming Motion Generation via Diffusion-based
  Autoregressive Model in Causal Latent Space",MotionStreamer：基于扩散的自回归模型在因果潜在空间中的流式运动生成,Diffusion Model,Other,https://arxiv.org/pdf/2503.15451,https://huggingface.co/papers/2503.15451,本论文提出了MotionStreamer，一个创新的框架，用于基于文本的流式动作生成。该方法通过引入连续的因果潜在空间，解决了现有模型在生成过程中面临的预定义动作长度限制和错误累积问题。MotionStreamer能够实时预测人类姿态，充分利用历史运动信息和实时文本输入，确保生成的动作具有语义一致性和动态适应性。实验结果表明，该模型在多轮生成、长期生成和动态动作组合等应用中优于现有方法，展示了其在实时应用中的广泛潜力。,3
"Painting with Words: Elevating Detailed Image Captioning with Benchmark
  and Alignment Learning",用文字绘画：通过基准和对齐学习提升详细图像描述,Multimodal LLM,ByteDance,https://arxiv.org/pdf/2503.07906,https://huggingface.co/papers/2503.07906,本论文提出了DeCapBench和新颖的评估指标DCScore，以提升详细图像描述的质量和评估方法。DCScore通过将生成的描述分解为基本信息单元，评估其准确性和全面性，显示出与人类判断的高度一致性。DeCapBench在描述性任务中与现有视觉语言模型的表现高度相关，超越了传统基准。同时，论文还介绍了一种自动化的细粒度反馈收集方法FeedQuill，优化了模型偏好。通过在多个视觉语言模型上的广泛实验，研究表明该方法显著减少了错误生成，并提升了描述性能，超越了GPT-4o。,2
"AIMI: Leveraging Future Knowledge and Personalization in Sparse Event
  Forecasting for Treatment Adherence",AIMI：利用未来知识和个性化在稀疏事件预测中的治疗依从性,Other,Other,https://arxiv.org/pdf/2503.16091,https://huggingface.co/papers/2503.16091,本论文提出了一种名为AIMI的智能药物遵从性预测系统，旨在提高慢性病患者的治疗遵从率。AIMI利用智能手机传感器和患者的既往用药历史，预测患者忘记服药的可能性。通过对27名心血管疾病患者的用户研究，研究团队开发了基于卷积神经网络（CNN）和长短期记忆网络（LSTM）的预测模型，LSTM模型的预测准确率达到93.2%，F1分数为93.6%。研究表明，结合未来知识和个性化训练可以显著提升药物遵从性预测的准确性，为开发个性化干预工具提供了新的思路。,1
Why Personalizing Deep Learning-Based Code Completion Tools Matters,个性化深度学习代码补全工具的重要性,LLM,Other,https://arxiv.org/pdf/2503.14201,https://huggingface.co/papers/2503.14201,本文探讨了深度学习（DL）代码补全工具在特定组织或开发者的个性化微调对其性能的影响。研究涉及136名来自Apache和Spring两个组织的开发者，比较了不同规模的T5和Code Llama模型在微调后的代码补全能力。结果显示，针对特定组织或开发者的微调显著提升了预测能力，尤其是组织特定的微调效果更佳。此外，经过微调的模型在完成性能上可与更大规模的预训练模型相媲美，同时减少了部署和推理成本。这一发现为代码补全工具的个性化应用提供了实证支持。,1
Where do Large Vision-Language Models Look at when Answering Questions?,大型视觉语言模型在回答问题时关注哪里？,Multimodal LLM,ByteDance,https://arxiv.org/pdf/2503.13891,https://huggingface.co/papers/2503.13891,本论文探讨了大型视觉语言模型（LVLMs）在回答问题时的视觉理解行为，尤其是它们如何依赖图像输入以及哪些图像区域对回答产生影响。研究中扩展了现有的热图可视化方法，以支持LVLM在开放式视觉问答中的应用，提出了一种选择与生成答案相关的视觉标记的方法。通过对多种LVLM在需要视觉信息的基准测试上的综合分析，论文揭示了焦点区域与答案正确性之间的关系、不同架构间的视觉注意差异，以及大型语言模型规模对视觉理解的影响。这些发现为理解LVLM的行为提供了重要见解。,1
TikZero: Zero-Shot Text-Guided Graphics Program Synthesis,TikZero：零-shot文本引导的图形程序合成,Multimodal LLM,Other,https://arxiv.org/pdf/2503.11509,https://huggingface.co/papers/2503.11509,论文《TikZero: Zero-Shot Text-Guided Graphics Program Synthesis》提出了一种新方法，旨在通过文本生成图形程序，解决现有数据稀缺的问题。TikZero利用图像表示作为中介，解耦了图形程序生成与文本理解，使得能够独立训练图形程序和带注释的图像。该方法在推理时实现了零-shot图形程序合成，显著超越了只能处理对齐数据的基线模型。此外，TikZero在利用对齐图形程序作为补充训练信号时，其性能可与更大模型相媲美，甚至超过商业系统如GPT-4o。研究的代码和数据集已公开。,1
"GASP: Unifying Geometric and Semantic Self-Supervised Pre-training for
  Autonomous Driving",GASP：统一几何和语义自监督预训练用于自动驾驶,Other,Other,https://arxiv.org/pdf/2503.15672,https://huggingface.co/papers/2503.15672,本论文提出了一种名为GASP的几何和语义自监督预训练方法，旨在提升自动驾驶系统对环境的理解能力。GASP通过预测未来时空点的通用占用、主体占用以及从视觉基础模型提取的高层特征，学习统一的环境表示。该方法以几何和语义四维占用场为基础，代替原始传感器数据，从而获得更结构化和可泛化的环境表示。实验结果表明，GASP在多个自动驾驶基准测试中显著提高了语义占用预测、在线地图构建和主体轨迹预测的性能，展示了其作为可扩展有效的预训练范式的潜力。,0
