标题,中文标题,领域分类,研究机构,PDF链接,论文链接,简明摘要,Upvote数
"Dita: Scaling Diffusion Transformer for Generalist
  Vision-Language-Action Policy",Dita：扩展扩散变换器用于通用视觉-语言-动作策略,Embodied AI,"Shanghai AI Lab, PKU, THU",https://arxiv.org/pdf/2503.19757,https://huggingface.co/papers/2503.19757,论文介绍了Dita，一个基于Transformer架构的可扩展框架，旨在提升通用视觉-语言-动作策略的适应性。Dita通过统一的多模态扩散过程直接去噪连续动作序列，克服了传统方法在异构动作空间中的局限。其创新的上下文条件设计实现了去噪动作与历史观测的细致对齐，从而更好地建模动作变化和环境细节。Dita在多种机器人任务中展现出卓越的鲁棒性，能够在复杂场景和不同环境条件下进行有效的10-shot适应，推动了通用机器人策略学习的发展。,35
Qwen2.5-Omni Technical Report,Qwen2.5-Omni技术报告,Multimodal LLM,Other,https://arxiv.org/pdf/2503.20215,https://huggingface.co/papers/2503.20215,Qwen2.5-Omni是一种端到端的多模态模型，能够同时处理文本、图像、音频和视频，并实时生成文本和自然语音回应。该模型采用块处理方法来流式传输多模态信息，并通过创新的时间对齐位置嵌入（TMRoPE）同步音频与视频。其架构分为Thinker和Talker，前者负责文本生成，后者则生成音频输出。Qwen2.5-Omni在多个多模态基准测试中表现出色，尤其在语音指令跟随和语音生成方面，其流式输出在自然性和鲁棒性上优于大多数现有模型。这使其在语音对话和视频推理等任务中具有广泛应用潜力。,33
LEGO-Puzzles: How Good Are MLLMs at Multi-Step Spatial Reasoning?,LEGO-拼图：多模态大语言模型在多步骤空间推理中的表现如何？,Multimodal LLM,Shanghai AI Lab,https://arxiv.org/pdf/2503.19990,https://huggingface.co/papers/2503.19990,本论文提出了LEGO-Puzzles，一个用于评估多模态大型语言模型（MLLMs）在多步骤空间推理能力的基准。该基准包含1100个视觉问答样本，涵盖从基本空间理解到复杂多步骤推理的11个任务。研究发现，现有的最先进MLLMs在空间推理方面存在显著局限，准确率仅约50%，而人类参与者的准确率超过90%。此外，只有少数模型在生成遵循装配图的LEGO图像方面表现出一定能力。整体而言，LEGO-Puzzles揭示了当前MLLMs在空间理解和序列推理方面的关键不足，强调了进一步发展的必要性。,24
Wan: Open and Advanced Large-Scale Video Generative Models,Wan：开放与先进的大规模视频生成模型,Diffusion Model,Alibaba,https://arxiv.org/pdf/2503.20314,https://huggingface.co/papers/2503.20314,论文介绍了Wan，一个开放的高级视频生成模型套件，旨在推动视频生成技术的发展。Wan基于主流的扩散变换器架构，通过创新的空间-时间变分自编码器、可扩展的预训练策略和大规模数据整理，显著提升了生成能力。其14B参数模型在数十亿图像和视频的数据集上训练，表现优于现有的开源和商业模型。Wan提供1.3B和14B两个版本，适用于不同的应用场景，并具备出色的资源效率，适合普通消费者使用。此外，所有模型和代码均已开源，旨在促进视频生成社区的发展。,22
"Unconditional Priors Matter! Improving Conditional Generation of
  Fine-Tuned Diffusion Models",无条件先验很重要！改善微调扩散模型的条件生成,Diffusion Model,Other,https://arxiv.org/pdf/2503.20240,https://huggingface.co/papers/2503.20240,本论文探讨了无条件先验在条件生成中的重要性，提出了一种改进方法以提升微调扩散模型的生成质量。研究发现，现有的无条件噪声预测能力不足，严重影响了条件生成的效果。通过用基模型预测的无条件噪声替换微调模型中的无条件噪声，显著提升了生成质量。此外，论文还表明，不同于微调模型的扩散模型同样可以用于无条件噪声的替代。实验结果在多个条件扩散模型（如Zero-1-to-3、Versatile Diffusion、InstructPix2Pix等）上得到了验证，显示出该方法的有效性。,18
Open Deep Search: Democratizing Search with Open-source Reasoning Agents,开放深度搜索：通过开源推理智能体实现搜索的民主化,Agent,Other,https://arxiv.org/pdf/2503.20201,https://huggingface.co/papers/2503.20201,本文介绍了Open Deep Search (ODS)，旨在缩小开放源代码搜索AI解决方案与专有搜索AI之间的差距。ODS通过引入开放搜索工具和开放推理代理，增强了最新开源大型语言模型（LLMs）的推理能力，使其能够更有效地利用网络搜索工具回答查询。ODS在两个基准测试（SimpleQA和FRAMES）中表现出色，甚至在FRAMES基准上比现有的最佳专有解决方案提高了9.7%的准确率。该框架不仅提升了开源LLMs的性能，还促进了搜索AI领域的透明性和创新，推动了开发者社区的成长。,18
"GenHancer: Imperfect Generative Models are Secretly Strong
  Vision-Centric Enhancers",GenHancer：不完美的生成模型在视觉中心增强中的潜在强大,Multimodal LLM,Tencent,https://arxiv.org/pdf/2503.19480,https://huggingface.co/papers/2503.19480,本论文提出了GenHancer，一种新颖的视觉增强方法，旨在改善生成模型与判别模型（如CLIP）之间的协同作用。研究发现，视觉上完美的生成结果并不总能有效提升表示能力。通过分析条件机制、去噪配置和生成范式，作者提出使用全球视觉标记作为条件、采用两阶段训练策略，以及利用轻量级去噪器来提取有用的细粒度知识。实验表明，GenHancer在MMVP-VLM基准上显著超越了现有方法，提升了多模态大语言模型的视觉性能。所有模型和代码均已公开。,12
"BizGen: Advancing Article-level Visual Text Rendering for Infographics
  Generation",BizGen：推进信息图生成的文章级视觉文本渲染,Other,"Microsoft, THU",https://arxiv.org/pdf/2503.20672,https://huggingface.co/papers/2503.20672,本文提出了BizGen，一个针对文章级视觉文本渲染的创新系统，旨在生成高质量的商业内容，如信息图和幻灯片。与现有的句子级生成模型相比，BizGen处理更长的上下文和超密集布局，面临更大的挑战。论文的主要贡献包括构建了一个高质量商业内容数据集Infographics-650K，以及提出了一种布局引导的交叉注意机制，以灵活处理多个子区域。实验结果表明，BizGen在生成效果上超越了现有的先进模型，推动了商业内容生成领域的发展。,10
Gemini Robotics: Bringing AI into the Physical World,双子机器人：将人工智能带入物理世界,Embodied AI,"DeepMind, Google",https://arxiv.org/pdf/2503.20020,https://huggingface.co/papers/2503.20020,本文介绍了Gemini Robotics，一个新型的人工智能模型家族，旨在将AI技术应用于机器人领域。基于Gemini 2.0，Gemini Robotics是一个先进的视觉-语言-动作（VLA）模型，能够直接控制机器人并执行复杂的操作任务。该模型具备对不同物体类型和位置的适应能力，能够在未知环境中执行多样化的指令。通过进一步的微调，Gemini Robotics可以学习新任务并适应不同的机器人形态。此外，Gemini Robotics-ER模型增强了其在物理世界的空间和时间理解能力，为机器人应用提供了广泛的支持。这一研究标志着实现通用机器人技术的重要进展。,9
"MCTS-RAG: Enhancing Retrieval-Augmented Generation with Monte Carlo Tree
  Search",MCTS-RAG：通过蒙特卡洛树搜索增强检索增强生成,LLM,Other,https://arxiv.org/pdf/2503.20757,https://huggingface.co/papers/2503.20757,本文提出了一种新方法MCTS-RAG，通过结合检索增强生成（RAG）和蒙特卡罗树搜索（MCTS），提升小型语言模型在知识密集型任务中的推理能力。MCTS-RAG通过动态整合检索和推理，优化决策过程，克服了传统RAG和MCTS方法在知识整合上的局限。实验结果表明，该方法在多个推理和知识密集型数据集上表现出色，使小型模型的性能与前沿大模型（如GPT-4o）相当，设定了小型模型推理的新标准。这一创新为知识密集型任务提供了更高的准确性和一致性。,6
AccVideo: Accelerating Video Diffusion Model with Synthetic Dataset,AccVideo：利用合成数据集加速视频扩散模型,Diffusion Model,Shanghai AI Lab,https://arxiv.org/pdf/2503.19462,https://huggingface.co/papers/2503.19462,本论文提出了一种名为AccVideo的新方法，旨在加速视频扩散模型的生成过程。传统的扩散模型需要大量推理步骤，导致生成速度慢且计算成本高。AccVideo通过生成合成数据集，利用预训练的视频扩散模型创建有效的去噪轨迹，从而减少了不必要的数据点。该方法采用基于轨迹的少步引导技术，提升了视频生成的效率，并引入对抗训练策略以改善视频质量。实验结果表明，AccVideo在生成速度上比教师模型提高了8.5倍，同时保持了相似的生成质量，能够生成更高分辨率的视频。,5
"LogQuant: Log-Distributed 2-Bit Quantization of KV Cache with Superior
  Accuracy Preservation",LogQuant：具有卓越准确性保留的KV缓存的对数分布2位量化,LLM,Other,https://arxiv.org/pdf/2503.19950,https://huggingface.co/papers/2503.19950,本文介绍了LogQuant，一种创新的2位量化技术，旨在优化大语言模型（LLM）推理中的KV缓存。LogQuant通过采用基于对数的过滤机制，选择性地压缩KV缓存，从而在保持或减少内存占用的同时，实现更优的性能。与传统方法相比，LogQuant在基准测试中提升了25%的吞吐量和60%的批量大小，同时在数学和代码补全等复杂任务中，准确率提高了40%至200%。该技术与流行的推理框架（如Python的transformers库）无缝集成，具有显著的实用价值。,5
ViLBench: A Suite for Vision-Language Process Reward Modeling,ViLBench：一种用于视觉-语言过程奖励建模的套件,Multimodal LLM,Amazon,https://arxiv.org/pdf/2503.20271,https://huggingface.co/papers/2503.20271,本文介绍了ViLBench，一个针对视觉-语言过程奖励建模的基准套件。研究首先对当前的视觉大型语言模型（VLLMs）进行了评估，发现输出奖励模型（ORMs）和过程奖励模型（PRMs）在不同任务中的表现不一，且更强的VLLMs并不一定带来更好的奖励性能。为填补这一评估空白，ViLBench被设计为需要密集过程奖励信号的基准，显著挑战现有模型。通过收集73.6K的视觉-语言过程奖励数据，研究展示了一种提高模型表现的潜在方法，最终实现了对标准模型的平均提升。相关代码和数据已公开。,4
Attention IoU: Examining Biases in CelebA using Attention Maps,注意力IoU：使用注意力图检查CelebA中的偏见,Other,Other,https://arxiv.org/pdf/2503.19846,https://huggingface.co/papers/2503.19846,本论文提出了Attention-IoU（注意力交并比）指标，用于揭示计算机视觉模型中的偏见，尤其是在CelebA数据集中的表现。与现有的偏见量化方法不同，Attention-IoU通过分析模型的注意力图，识别出潜在的偏见来源和图像特征。研究首先在合成的Waterbirds数据集上验证了该指标的有效性，随后分析了CelebA数据集，发现其揭示的偏见超出了准确性差异。通过对男性属性的深入调查，研究展示了偏见的多样性，并通过调整训练集的属性相关性，揭示了数据标签中未包含的潜在混杂变量。这一工作为理解和缓解模型偏见提供了新的视角。,4
"ADS-Edit: A Multimodal Knowledge Editing Dataset for Autonomous Driving
  Systems",ADS-Edit：用于自主驾驶系统的多模态知识编辑数据集,Multimodal LLM,Other,https://arxiv.org/pdf/2503.20756,https://huggingface.co/papers/2503.20756,本论文提出了ADS-Edit，一个专为自动驾驶系统（ADS）设计的多模态知识编辑数据集，以应对大型多模态模型在实际应用中面临的挑战，如交通知识误解、复杂的道路条件和车辆运动状态多样性。通过知识编辑技术，该方法允许在不进行全面重训练的情况下，对模型行为进行有针对性的修改。数据集包含多种真实场景和数据类型，并提供全面的评估指标。研究结果表明，该方法在提升自动驾驶系统的知识更新能力方面具有潜在价值，促进了知识编辑在该领域的应用发展。,3
"Beyond Words: Advancing Long-Text Image Generation via Multimodal
  Autoregressive Models",超越文字：通过多模态自回归模型推进长文本图像生成,Multimodal LLM,Microsoft,https://arxiv.org/pdf/2503.20198,https://huggingface.co/papers/2503.20198,该论文首次专注于长文本图像生成，解决了现有文本到图像系统在处理长段落时的不足。研究者提出了一种新的文本聚焦二进制分词器，优化了长文本特征的捕捉。基于此，开发了名为LongTextAR的多模态自回归模型，能够高质量生成长文本图像，具备良好的可控性，支持字体样式、大小、颜色和对齐方式的定制。实验结果表明，LongTextAR在生成准确、一致和灵活的长文本方面显著优于现有模型。该模型的创新为文档和幻灯片生成等新应用提供了广阔的可能性。,3
"Self-Supervised Learning of Motion Concepts by Optimizing
  Counterfactuals",通过优化反事实进行运动概念的自监督学习,Other,Other,https://arxiv.org/pdf/2503.19953,https://huggingface.co/papers/2503.19953,本论文提出了一种名为Opt-CWM的自监督学习方法，用于从视频中估计运动和遮挡，克服了依赖合成数据和特定启发式调优的传统方法的局限性。Opt-CWM通过优化反事实探针，从预训练的下一帧预测模型中提取运动信息，避免了固定启发式的需求，并能够在无标签数据的情况下，处理多样化的视频输入。实验结果表明，该方法在真实视频的运动估计任务中达到了最先进的性能，展示了自监督学习在计算机视觉领域的潜力。,2
Sparse Logit Sampling: Accelerating Knowledge Distillation in LLMs,稀疏Logit采样：加速大语言模型中的知识蒸馏,LLM,Other,https://arxiv.org/pdf/2503.16870,https://huggingface.co/papers/2503.16870,本论文提出了一种名为“随机采样知识蒸馏”的新方法，以加速大语言模型（LLMs）的知识蒸馏过程。研究发现，传统的稀疏知识蒸馏方法（如缓存Top-K概率）会导致教师概率分布的偏差，从而影响学生模型的性能和校准。新方法通过重要性采样提供无偏估计，保留期望梯度，并显著减少所需存储的logits量。与交叉熵训练相比，该方法在训练学生模型时仅增加少于10%的开销，同时在300M到3B规模的模型中保持竞争力的性能。这为大语言模型的高效训练提供了新的思路。,2
DINeMo: Learning Neural Mesh Models with no 3D Annotations,DINeMo：无3D标注学习神经网格模型,Embodied AI,Other,https://arxiv.org/pdf/2503.20220,https://huggingface.co/papers/2503.20220,论文提出了DINeMo，一种新型的神经网格模型，能够在没有3D注释的情况下进行类别级3D/6D姿态估计。通过利用大型视觉基础模型生成的伪对应关系，DINeMo采用双向生成方法，结合局部外观特征和全局上下文信息，显著提高了对部分遮挡和领域转移的鲁棒性。实验结果表明，DINeMo在汽车数据集上的表现超越了以往的零样本和少样本3D姿态估计，缩小了与完全监督方法的差距达67.3%。此外，DINeMo在训练过程中有效整合更多未标记图像，展示了其在不依赖3D注释的情况下的优越性和可扩展性。,2
"Image as an IMU: Estimating Camera Motion from a Single Motion-Blurred
  Image",图像作为IMU：从单幅运动模糊图像估计相机运动,Other,Other,https://arxiv.org/pdf/2503.17358,https://huggingface.co/papers/2503.17358,本论文提出了一种新颖的方法，通过单张运动模糊图像估计相机运动，解决了快速相机运动导致的模糊问题。该方法利用运动模糊作为运动估计的有效线索，直接预测密集的运动流场和单目深度图。通过在小运动假设下求解线性最小二乘问题，恢复瞬时相机速度。研究团队构建了一个大型合成数据集，并在真实数据上进行了端到端训练。实验结果表明，该方法在角速度和位移估计上超越了现有技术，如MASt3R和COLMAP，展现了其在机器人和虚拟现实应用中的潜在价值。,1
"PathoHR: Breast Cancer Survival Prediction on High-Resolution
  Pathological Images",PathoHR：基于高分辨率病理图像的乳腺癌生存预测,Other,Other,https://arxiv.org/pdf/2503.17970,https://huggingface.co/papers/2503.17970,本文介绍了PathoHR，一个用于乳腺癌生存预测的新型管道，旨在解决肿瘤异质性带来的挑战。该方法通过引入高分辨率的视觉变换器（ViT），增强了病理全切片图像（WSIs）的特征提取能力。研究表明，采用该管道的小图像块能够在预测准确性上与较大图像块相当或更优，同时显著降低计算负担。PathoHR的实验结果表明，它在提高图像分辨率与优化特征学习的结合方面，提供了一种前景广阔的解决方案，为乳腺癌生存预测的准确性和效率提升开辟了新方向。,0
"UniHDSA: A Unified Relation Prediction Approach for Hierarchical
  Document Structure Analysis",UniHDSA：一种用于层次文档结构分析的统一关系预测方法,Other,Microsoft,https://arxiv.org/pdf/2503.15893,https://huggingface.co/papers/2503.15893,本论文提出了一种统一的关系预测方法UniHDSA，用于层次文档结构分析（HDSA），旨在恢复使用层次化模式创建的文档的结构。与以往研究专注于单一子任务不同，UniHDSA将多个HDSA子任务视为关系预测问题，并将预测标签整合到统一的标签空间中，从而实现单一模块同时处理多个任务。通过基于Transformer架构的端到端系统，实验结果表明，该方法在层次文档结构分析基准Comp-HRDoc上达到了最先进的性能，并在大规模文档布局分析数据集DocLayNet上表现出竞争力，展示了其在各子任务中的优越性。,0
