公众号,发布时间,原标题,科技报告标题,摘要,领域分类,研究机构,行业大佬,URL
机器之心,2025-03-18 08:46:31,ChatGPT创始成员、后训练负责人官宣离职！自立门户并将获OpenAI投资,OpenAI后训练负责人William Fedus离职并创立新公司,William Fedus，OpenAI的后训练负责人及研究副总裁，宣布离职并计划创立一家专注于材料科学的AI初创公司。Fedus在公开信中表达了对未来合作的期待，并感谢了OpenAI的团队和领导。他的离职标志着OpenAI又一位重要员工的流失，同时OpenAI表示将投资并与其新公司合作。Fedus的学术背景包括在MIT和剑桥大学的物理学学习，以及在蒙特利尔大学获得计算机科学博士学位。,Other,"OpenAI, Google","William Fedus, Sam Altman, Greg Brockman, Mark Chen, Noam Brown, Yoshua Bengio",https://mp.weixin.qq.com/s/AH03xhDY-0GfS3rTGwyH1g
机器之心,2025-03-18 08:46:31,模态GAP不存在了？图文领域首个token级大一统基座诞生,图文领域首个Token级大一统基座的实现,本文介绍了上交与美团联合研发的Token级图文数据集TokenIT及细粒度基座TokenFD的重磅问世。这些创新推动了多模态大模型的发展，特别是在处理包含密集文字的文档图像方面。TokenIT包含2000万条图像和18亿Token-Mask对，支持图像与语言Token的共享与交互。TokenFD通过简化的编码方法实现了图像与语言的细粒度对齐，显著提升了多项下游任务的性能，推动了多模态文档理解的进步。,Multimodal LLM,Other,None,https://mp.weixin.qq.com/s/dL9wH2XAktxnupl5-K73Aw
新智元,2025-03-18 08:42:38,刚刚，o1/o3后训练掌门人出走创业，OpenAI鼎力支持押注AI材料！曾师从Bengio,OpenAI后训练团队负责人William Fedus离职创业，获OpenAI投资支持,William Fedus，OpenAI后训练团队负责人，宣布离职并创办一家专注于AI材料的创业公司。OpenAI决定对其新公司进行投资并建立合作关系。Fedus在信中表达了对OpenAI的感激，并表示将继续关注团队的成功。Fedus曾在谷歌大脑工作，参与多个重要AI模型的研发，并在计算机科学领域获得博士学位，师从Yoshua Bengio。此举标志着OpenAI再次失去一名重要领导者。,Other,"OpenAI, Google","William Fedus, Sam Altman, Greg Brockman, Mark Chen, Yoshua Bengio",https://mp.weixin.qq.com/s/d04R8r1pICndsRXTNs9bZw
量子位,2025-03-18 08:11:42,陶哲轩：o3-mini纠正了我一个数学错误，十分钟解决原本一小时才能完成的题目,陶哲轩与o3-mini的数学协作体验,在这篇文章中，陶哲轩分享了他使用o3-mini解决数学问题的经历。o3-mini不仅纠正了他的一个错误，还帮助他在十分钟内完成了原本需要一小时的代码生成和测试。与此同时，CMU的罗博深教授也对GPT-o1在数学考试中的表现感到震惊，指出其在新设计的非标准问题上表现出色。文章探讨了大语言模型在数学领域的进步及其对科学研究的影响。,LLM,Other,"陶哲轩, 罗博深",https://mp.weixin.qq.com/s/d090yFiv_hkdjDjzIxWxww
量子位,2025-03-18 08:11:42,最后1周！今年最值得关注的AIGC企业/产品正在评选中,2025年度AIGC企业与产品评选启动,量子位公众号发布了关于2025年值得关注的AIGC企业和产品的评选通知。此次评选将于2025年3月24日截止，旨在通过对过去一年AIGC企业和产品表现的评估，发掘具有潜力和创新性的团队与产品。评选将涵盖技术、产品、市场及潜力等多个维度，并将在4月的中国AIGC产业峰会上公布结果。峰会将邀请多位行业领军人物分享对生成式AI的见解。,Other,Other,"袁佛玉, 关玮雅, 吴欣鸿, 徐元春, 林咏华, 卢志武",https://mp.weixin.qq.com/s/_-g689e9IHtvQK7jPGSoOw
量子位,2025-03-18 08:11:42,8张GPU训出近SOTA模型，超低成本图像生成预训练方案开源,LightGen: A Cost-Effective Pretraining Approach for High-Quality Image Generation,"LightGen is a new image generation model developed by a team from Hong Kong University of Science and Technology and Everlyn AI, which achieves near state-of-the-art (SOTA) performance with only 8 GPUs. Utilizing knowledge distillation and direct preference optimization, it significantly reduces training costs and resource requirements while maintaining high-quality outputs. The model demonstrates competitive results in benchmark evaluations, showcasing its potential for efficient image generation in resource-constrained environments.",Diffusion Model,Other,Harry Yang,https://mp.weixin.qq.com/s/9dyep_QSeJSZh61jCEzjkg
量子位,2025-03-18 10:13:16,量子位招聘 | DeepSeek帮我们改的招聘启事,量子位招聘启事,量子位发布招聘信息，寻求对AI大模型、具身智能、终端硬件和AI新媒体编辑感兴趣的原创作者。招聘岗位包括AI大模型方向、具身智能机器人、终端硬件和新媒体编辑，工作地点在北京中关村。应聘者需具备相关领域的热情和能力，提供竞争力薪资和职业发展机会。,Embodied AI,Other,None,https://mp.weixin.qq.com/s/KNT0yiqRQC1zo4ZcavD4Fg
量子位,2025-03-18 10:13:16,o1/o3后训练负责人离职创业，奥特曼把OpenAI玩成另一个YC孵化器了,OpenAI后训练负责人William Fedus离职创业，聚焦AI材料科学,OpenAI高管William Fedus宣布离职，计划创办一家专注于AI材料科学的新公司。这一决定是在OpenAI经历了一轮高管离职潮后做出的，Fedus在OpenAI的后训练研究中扮演了重要角色。他的离职标志着OpenAI人才流动的持续，尽管公司也在不断补充新鲜血液。Fedus的背景包括物理学和计算机科学，他曾在多个知名机构工作，未来将致力于将AI应用于物理学领域。,Other,"OpenAI, Google","William Fedus, Mira Murati, Barret Zoph, Yoshua Bengio",https://mp.weixin.qq.com/s/pMKfnfVgP8qF2C7UZplZ3g
新智元,2025-03-18 13:02:36,65岁陈立武点爆英特尔三把火！裁员砍中层，AI制造，争夺世界代工厂王座,陈立武接任英特尔CEO，推动制造与AI业务改革,65岁陈立武接任英特尔CEO，计划进行全面改革，重点在制造业升级、AI战略重塑和中层管理精简。面对公司历史上首次年度亏损，陈立武的改革措施旨在恢复英特尔的市场竞争力，吸引新客户并提升代工业务。尽管面临挑战，陈立武的计划已提振了股价，显示出市场对其改革的期待。,Other,Other,陈立武,https://mp.weixin.qq.com/s/ZzvLs4pJw93V3lY9Ewwy1Q
新智元,2025-03-18 15:30:12,中绿讯科8个月自研新一代AI生态平台！以央企担当，或破解产业核心难题,中绿讯科发布新一代AI生态平台，助力产业智能化转型,中绿讯科近日发布了基于自研泰山大模型群的AI生态平台，旨在为企业提供高效的AI解决方案。该平台集成了多项技术组件，能够帮助企业克服AI应用中的技术门槛和数据质量问题，促进业务智能化升级。中绿讯科作为央企与科大讯飞的合资公司，致力于通过与行业龙头企业的合作，推动AI技术在管理、能源和文旅等领域的实际应用。,Agent,Other,None,https://mp.weixin.qq.com/s/OoZLaQA9HBuKOYJ_YF7caA
新智元,2025-03-18 15:30:12,全球首个工业界多模态推理模型开源！38B硬刚DeepSeek-R1，训练秘籍全公开,全球首个工业界开源多模态推理模型Skywork R1V发布,昆仑万维推出全球首个工业界开源多模态推理模型Skywork R1V，参数达到38B，性能接近DeepSeek-R1。R1V在视觉问答和复杂推理任务中表现优异，创下多个基准测试的新高。该模型通过跨模态迁移学习有效结合文本与视觉推理能力，推动了多模态领域的技术进步。R1V的开源旨在促进技术共享，助力AGI的实现。,Multimodal LLM,Other,None,https://mp.weixin.qq.com/s/CYNce3oHoDrsOJSv5Pj6Nw
新智元,2025-03-18 15:30:12,CEAI 2025中国具身智能大会倒计时10天！著名院士领衔演讲，3天18场顶级论坛,CEAI 2025中国具身智能大会即将召开,CEAI 2025中国具身智能大会将于2025年3月28日至30日在北京举行，届时将有18场重磅学术论坛和多位院士的主旨演讲。大会由中国人工智能学会主办，涵盖生物启发的智能机器人、生成式AI与具身智能的融合等多个领域。参与机构包括清华大学、北京大学等顶尖学府及多家创新企业，旨在探讨具身智能的前沿科技及其在各行业的应用。,Embodied AI,Other,"谭铁牛, 王耀南, 郭雷",https://mp.weixin.qq.com/s/bTOzaS5THVRt6uj4zvkkVA
机器之心,2025-03-18 14:15:18,超越DeepSeek GRPO的关键RL算法，字节、清华AIR开源DAPO,字节与清华AIR开源DAPO算法的研究进展,本文介绍了字节跳动与清华大学人工智能研究院联合开源的DAPO（Dynamic Adaptive Policy Optimization）算法，该算法在强化学习领域超越了DeepSeek GRPO。文章详细阐述了DAPO的核心技术及其在智能体学习中的应用潜力，强调了该算法在动态环境中的适应性和效率，展示了其在实际应用中的前景。,Agent,"ByteDance, THU",None,https://mp.weixin.qq.com/s/_w_HtjNQiG-yP5LEN85o0Q
机器之心,2025-03-18 14:15:18,先别骂队友，上交如何让DeepSeek R1在分手厨房再也不糊锅？,基于Overcooked的实时人机协作智能体研究,本文探讨了如何通过DPT-Agent框架实现大模型与人类的实时同步协作，特别是在复杂的多人协作游戏《Overcooked》中。研究者们通过引入动态分工和预判式协作机制，提升了智能体在实时环境中的响应能力，推动了人智协同与多智能体系统的研究。文章由上海交通大学SJTU-MARL实验室与AGI-Eval评测社区联合撰写，强调了在现实应用中大模型与人类协作的重要性。,Agent,Other,"温颖, 张伟楠, Stuart Russell, Pieter Abbeel",https://mp.weixin.qq.com/s/dT9KQmebVJX0ewkzJmisPg
量子位,2025-03-18 19:53:56,速抢席位！在中国AIGC产业峰会现场，一起深度求索AI怎么用 ⁉️ 首批嘉宾已曝光,中国AIGC产业峰会即将召开，聚焦AI应用与发展,中国AIGC产业峰会将于4月16日在北京举行，主题为「万物皆可AI」。此次峰会旨在探讨AI的应用与发展，汇聚了多位行业领军人物，包括百度副总裁阮瑜、无问芯穹CEO夏立雪等。随着大模型技术的进步，AI在各行各业的应用不断扩展，峰会将为与会者提供深入交流与学习的机会，推动AI技术的落地与普及。,Agent,Other,"阮瑜, 夏立雪, 谭李, 喻友平, 姚欣, 田天, 陈建华",https://mp.weixin.qq.com/s/dyZt4Rx28Oew8Sic92m-2A
量子位,2025-03-18 19:53:56,马斯克进军AI视频，收购视频生成初创公司，4人13个月打造类Sora模型,马斯克收购视频生成初创公司Hotshot，布局AI视频领域,马斯克的xAI最近收购了视频生成初创公司Hotshot，该公司由4人团队在13个月内开发出3个视频生成模型。Hotshot最初专注于图片生成，后来转向视频生成，成功推出了多个模型。此次收购标志着马斯克希望通过自研视频生成技术与OpenAI和谷歌等公司展开竞争。Hotshot团队的创始人曾在视频聊天和视觉通讯领域有过尝试，最终决定开发更具控制权的视频生成模型。,Other,Other,"Aakash Sastry, John Mullan, Alexis Ohanian",https://mp.weixin.qq.com/s/DgYseRVqfOy8_HvZC5aFbg
量子位,2025-03-18 19:53:56,DeepSeek让英伟达H20都被疯抢，但AI推理爆发不只靠囤卡,DeepSeek推动AI推理需求爆发与算力市场变化,本文探讨了DeepSeek的算法创新如何重构AI算力逻辑，推动AI计算从训练向推理转变。英伟达H20显卡因DeepSeek的热潮而需求激增，尽管其性能不及H100，但在推理任务中表现出色。DeepSeek开源的模型通过混合专家架构和强化学习显著提升了推理效率，满足了日益增长的AI推理需求，改变了算力市场的格局。文章还分析了未来推理计算的趋势及其对行业的深远影响。,LLM,Other,"姚欣, 黄仁勋",https://mp.weixin.qq.com/s/WRF1SqubQtC-alqnzNgueA
量子位,2025-03-18 19:53:56,北大人形机器人智能体 Being-0：互联网视频+少量真机数据，迈向自主具身智能,北大人形机器人智能体 Being-0 的自主具身智能研究,北京大学卢宗青团队提出的Being-0是首个集运动、导航和灵巧操作于一体的人形机器人智能体。该研究采用模块化的分层端到端架构，结合互联网视频和少量真机数据，实现了机器人在复杂环境中的自主任务规划与执行。Being-0通过视觉语言模型和技能库的协同作用，显著提高了任务成功率，展现了人类级别的灵巧操作能力，为人形机器人在现实生活中的应用奠定了基础。,Embodied AI,PKU,None,https://mp.weixin.qq.com/s/pa3FTxlBUhMjJI4QY4iOEw
量子位,2025-03-18 19:53:56,量子位招聘 | DeepSeek帮我们改的招聘启事,量子位招聘启事,量子位发布招聘启事，寻求对AI大模型、具身智能、终端硬件及AI新媒体编辑感兴趣的原创作者。岗位包括全职编辑和实习生，工作地点在北京中关村。应聘者需具备相关领域的热情与能力，能够撰写深度文章、分析行业动态，并参与内容运营。量子位提供竞争力的薪资待遇及职业发展机会，欢迎志同道合的伙伴加入。,Embodied AI,Other,None,https://mp.weixin.qq.com/s/fIx_DirExHJ4lJ4m4Q2zmg
量子位,2025-03-18 19:53:56,你正在做的大模型评测，可能有一半都是无用功 | 上海AI Lab&上交&浙大出品,大模型评测的有效性分析,本文探讨了当前大模型评测方法的有效性，指出许多评测可能存在无效或误导性的问题。通过对上海AI Lab、上交和浙大的研究成果进行分析，作者强调了在评测过程中需要更加严谨和科学的方法，以确保评测结果的可靠性和实用性。文章还提出了一些改进建议，旨在提升大模型评测的整体质量。,LLM,Shanghai AI Lab,None,https://mp.weixin.qq.com/s/-ZJ2eUm4KxTMLzWgTC9cfg
新智元,2025-03-18 18:35:13,AI真·抢饭碗？美国码农就业跌至1980年以来最低，重回「吃豆人」时代,美国程序员就业人数降至1980年以来最低水平，AI影响显著,随着人工智能技术的崛起，美国程序员的就业人数已降至1980年以来的最低水平。根据劳工统计局的数据，自2023年以来，程序员年均就业人数骤降27.5%，这一趋势与OpenAI推出ChatGPT的时间高度吻合。尽管AI在某些编码任务上展现出强大能力，但专家认为人类程序员依然不可或缺。与此同时，亚马逊计划裁掉1.4万管理岗位，进一步反映出AI对科技行业的深远影响。,Other,"OpenAI, Meta, Amazon","Mark Muro, Arvind Krishna, Dario Amodei, Andy Jassy",https://mp.weixin.qq.com/s/tKFxsguyalJJmMTuKAm9HQ
机器之心,2025-03-18 15:35:10,单个4090就能跑，Mistral开源多模态小模型，开发者：用来构建推理模型足够香,Mistral开源多模态小模型在单个4090上运行,Mistral AI近日开源了其新款24B多模态小模型Mistral Small 3.1，该模型在多个基准测试中超越了Gemma 3和GPT-4o Mini，推理速度达到150个token/秒。该模型可在单个RTX 4090或32GB RAM的Mac上运行，适合多种生成式AI任务，包括对话辅助和图像理解。Mistral Small 3.1采用Apache 2.0开源协议，支持研究和商业应用，已吸引开发者进行部署和微调。,Multimodal LLM,Other,None,https://mp.weixin.qq.com/s/t173XAigACpw9NWPePhUUQ
机器之心,2025-03-18 15:35:10,本地也能运行Deep Research！支持arXiv平台，兼容PDF、Markdown等,本地运行的Deep Research系统及其功能分析,本文介绍了OpenAI推出的Deep Research系统的本地运行版本，该系统能够根据用户需求进行信息检索、整合和深度分析，保护用户隐私。新版本支持多种文档格式和云端大语言模型，具备自动追踪引用、智能分析搜索源等功能，旨在为用户提供全面的研究支持。项目已在GitHub上获得1.4k star，用户可根据需求定制AI模型以优化研究效果。,Agent,OpenAI,None,https://mp.weixin.qq.com/s/U5lXj0lhMR6x_Wy3GHpNfQ
机器之心,2025-03-18 15:35:10,多模态也做到了强推理！工业界首个开源的R1V，让视觉思考进入o1时代,昆仑万维发布开源多模态推理模型R1V,昆仑万维于2025年3月18日发布了Skywork R1V系列模型，成为国内首个开源多模态思维链推理模型。R1V在视觉推理和通用推理能力上达到了SOTA水平，尤其在数学推理和逻辑推理任务中表现优异。该模型能够同时处理文本与视觉信息，展现出强大的跨模态推理能力，拓展了AI应用的多种可能性。R1V的技术创新使其在多模态推理领域取得了重要突破。,Multimodal LLM,Other,None,https://mp.weixin.qq.com/s/IPPDuApVVKNJffAZcJqFRA
机器之心,2025-03-18 15:35:10,深度学习的平衡之道：港科大、港城大等团队联合发布多目标优化最新综述,深度学习中的多目标优化综述,本文综述了多目标优化在深度学习中的应用，特别是在多任务学习和大语言模型的多维度价值对齐方面。来自香港科技大学、香港城市大学及UIUC的研究团队探讨了如何在复杂需求下平衡多个目标，介绍了基于梯度的多目标优化算法及其理论与应用，强调了该领域在解决现实问题中的重要性。,Other,Other,"陈巍昱, 张霄远, 林百炅, 林熙, 赵晗, 张青富, 郭天佑",https://mp.weixin.qq.com/s/02EUbz4NHbafqctxToHYAA
